id;entityBeforeFullName;entityBeforeSimpleName;entityBeforeLocation;entityBeforeParameters;entityBeforeLine;entityBeforeParents;entityAfterFullName;entityAfterSimpleName;entityAfterLocation;entityAfterParameters;entityAfterLine;entityAfterParents;refactoringLevel;refactoringType;commitHash;abbreviatedCommitHash;authorName;authorEmail;authorDate;authorDateUnixTimestamp;committerName;committerEmail;committerDate;committerDateUnixTimestamp;idOracle;descriptionOracle
0;com.facebook.internal.AttributionIdentifiers#getAndroidId(Context);;;;;;com.facebook.internal.AttributionIdentifiers#getAndroidIdViaReflection(Context);;;;;;MethodDeclaration;EXTRACT;e813a0be86c87366157a0201e6c61662cadee586;e813a0be8;;;;;;;;;1125333;Extract Method private getAndroidIdViaReflection(context Context) : AttributionIdentifiers extracted from private getAndroidId(context Context) : AttributionIdentifiers in class com.facebook.internal.AttributionIdentifiers
1;com.facebook.login.KatanaProxyLoginMethodHandler#handleResultOk(LoginClient.Request,Intent);;;;;;com.facebook.login.KatanaProxyLoginMethodHandler#getErrorMessage(Bundle);;;;;;MethodDeclaration;EXTRACT;19d1936c3b07d97d88646aeae30de747715e3248;19d1936c3;;;;;;;;;1137085;Extract Method private getErrorMessage(extras Bundle) : String extracted from private handleResultOk(request LoginClient.Request, data Intent) : LoginClient.Result in class com.facebook.login.KatanaProxyLoginMethodHandler
2;com.facebook.FacebookSdk#sdkInitialize(Context,int);;;;;;com.facebook.FacebookSdk#sdkInitialize(Context,int,InitializeCallback);;;;;;MethodDeclaration;EXTRACT;19d1936c3b07d97d88646aeae30de747715e3248;19d1936c3;;;;;;;;;1137085;Extract Method public sdkInitialize(applicationContext Context, callbackRequestCodeOffset int, callback InitializeCallback) : void extracted from public sdkInitialize(applicationContext Context, callbackRequestCodeOffset int) : void in class com.facebook.FacebookSdk
3;com.facebook.FacebookSdk#sdkInitialize(Context);;;;;;com.facebook.FacebookSdk#sdkInitialize(Context,InitializeCallback);;;;;;MethodDeclaration;EXTRACT;19d1936c3b07d97d88646aeae30de747715e3248;19d1936c3;;;;;;;;;1137085;Extract Method public sdkInitialize(applicationContext Context, callback InitializeCallback) : void extracted from public sdkInitialize(applicationContext Context) : void in class com.facebook.FacebookSdk
4;com.facebook.login.KatanaProxyLoginMethodHandler#handleResultOk(LoginClient.Request,Intent);;;;;;com.facebook.login.KatanaProxyLoginMethodHandler#getError(Bundle);;;;;;MethodDeclaration;EXTRACT;19d1936c3b07d97d88646aeae30de747715e3248;19d1936c3;;;;;;;;;1137085;Extract Method private getError(extras Bundle) : String extracted from private handleResultOk(request LoginClient.Request, data Intent) : LoginClient.Result in class com.facebook.login.KatanaProxyLoginMethodHandler
