id;entityBeforeFullName;entityBeforeSimpleName;entityBeforeLocation;entityBeforeParameters;entityBeforeLine;entityBeforeParents;entityAfterFullName;entityAfterSimpleName;entityAfterLocation;entityAfterParameters;entityAfterLine;entityAfterParents;refactoringLevel;refactoringType;commitHash;abbreviatedCommitHash;authorName;authorEmail;authorDate;authorDateUnixTimestamp;committerName;committerEmail;committerDate;committerDateUnixTimestamp;idOracle;descriptionOracle
0;com.graphhopper.storage.GraphHopperStorage#setAdditionalEdgeField(long,int);;;;;;com.graphhopper.storage.BaseGraph#setAdditionalEdgeField(long,int);;;;;;MethodDeclaration;EXTRACT_MOVE;7f80425b6a0af9bdfef12c8a873676e39e0a04a6;7f80425b6;;;;;;;;;1117304;Extract And Move Method public setAdditionalEdgeField(edgePointer long, value int) : void extracted from public setAdditionalEdgeField(edgePointer long, value int) : void in class com.graphhopper.storage.GraphHopperStorage & moved to class com.graphhopper.storage.BaseGraph
1;com.graphhopper.routing.AbstractRoutingAlgorithmTester#testTwoWeightsPerEdge2();;;;;;com.graphhopper.routing.AbstractRoutingAlgorithmTester#getGraph(GraphHopperStorage);;;;;;MethodDeclaration;EXTRACT;7f80425b6a0af9bdfef12c8a873676e39e0a04a6;7f80425b6;;;;;;;;;1117304;Extract Method protected getGraph(ghStorage GraphHopperStorage) : Graph extracted from public testTwoWeightsPerEdge2() : void in class com.graphhopper.routing.AbstractRoutingAlgorithmTester
2;com.graphhopper.routing.AbstractRoutingAlgorithmTester#testWithCoordinates();;;;;;com.graphhopper.routing.AbstractRoutingAlgorithmTester#getGraph(GraphHopperStorage);;;;;;MethodDeclaration;EXTRACT;7f80425b6a0af9bdfef12c8a873676e39e0a04a6;7f80425b6;;;;;;;;;1117304;Extract Method protected getGraph(ghStorage GraphHopperStorage) : Graph extracted from public testWithCoordinates() : void in class com.graphhopper.routing.AbstractRoutingAlgorithmTester
3;com.graphhopper.routing.ch.DijkstraBidirectionCHTest#createFactory(Graph,AlgorithmOptions);;;;;;com.graphhopper.routing.ch.DijkstraBidirectionCHTest#getGraph(GraphHopperStorage);;;;;;MethodDeclaration;EXTRACT;7f80425b6a0af9bdfef12c8a873676e39e0a04a6;7f80425b6;;;;;;;;;1117304;Extract Method protected getGraph(ghStorage GraphHopperStorage) : LevelGraph extracted from public createFactory(g Graph, opts AlgorithmOptions) : RoutingAlgorithmFactory in class com.graphhopper.routing.ch.DijkstraBidirectionCHTest
4;com.graphhopper.storage.GraphHopperStorage#setSegmentSize(int);;;;;;com.graphhopper.storage.BaseGraph#setSegmentSize(int);;;;;;MethodDeclaration;EXTRACT_MOVE;7f80425b6a0af9bdfef12c8a873676e39e0a04a6;7f80425b6;;;;;;;;;1117304;Extract And Move Method package setSegmentSize(bytes int) : void extracted from public setSegmentSize(bytes int) : void in class com.graphhopper.storage.GraphHopperStorage & moved to class com.graphhopper.storage.BaseGraph
5;com.graphhopper.storage.GraphHopperStorage#toDetailsString();;;;;;com.graphhopper.storage.BaseGraph#toDetailsString();;;;;;MethodDeclaration;EXTRACT_MOVE;7f80425b6a0af9bdfef12c8a873676e39e0a04a6;7f80425b6;;;;;;;;;1117304;Extract And Move Method package toDetailsString() : String extracted from public toDetailsString() : String in class com.graphhopper.storage.GraphHopperStorage & moved to class com.graphhopper.storage.BaseGraph
6;com.graphhopper.storage.GraphHopperStorage#getCapacity();;;;;;com.graphhopper.storage.BaseGraph#getCapacity();;;;;;MethodDeclaration;EXTRACT_MOVE;7f80425b6a0af9bdfef12c8a873676e39e0a04a6;7f80425b6;;;;;;;;;1117304;Extract And Move Method package getCapacity() : long extracted from public getCapacity() : long in class com.graphhopper.storage.GraphHopperStorage & moved to class com.graphhopper.storage.BaseGraph
7;com.graphhopper.storage.GraphHopperStorage#edge(int,int,double,boolean);;;;;;com.graphhopper.storage.LevelGraphImpl#edge(int,int,double,boolean);;;;;;MethodDeclaration;EXTRACT_MOVE;7f80425b6a0af9bdfef12c8a873676e39e0a04a6;7f80425b6;;;;;;;;;1117304;Extract And Move Method public edge(a int, b int, distance double, bothDirections boolean) : EdgeIteratorState extracted from public edge(a int, b int, distance double, bothDirection boolean) : EdgeIteratorState in class com.graphhopper.storage.GraphHopperStorage & moved to class com.graphhopper.storage.LevelGraphImpl
