entityBeforeFullName;entityBeforeSimpleName;entityBeforeLocation;entityBeforeParameters;entityBeforeLine;entityBeforeParents;entityAfterFullName;entityAfterSimpleName;entityAfterLocation;entityAfterParameters;entityAfterLine;entityAfterParents;refactoringLevel;refactoringType;commitHash;abbreviatedCommitHash;authorName;authorEmail;authorDate;authorDateUnixTimestamp;committerName;committerEmail;committerDate;committerDateUnixTimestamp;idOracle;descriptionOracle
jetbrains.mps.smodel.adapter.structure.MetaAdapterFactory#getLanguage(SLanguageId,String,int);;;;;;jetbrains.mps.smodel.adapter.structure.MetaAdapterFactory#getLanguage(SLanguageId,String);;;;;;MethodDeclaration;INLINE;2bcd05a827ead109a56cb1f79a83dcd332f42888;2bcd05a82;;;;;;;;;1105075;Inline Method public getLanguage(id SLanguageId, langName String, version int) : SLanguage inlined to public getLanguage(id SLanguageId, langName String) : SLanguage in class jetbrains.mps.smodel.adapter.structure.MetaAdapterFactory
jetbrains.mps.text.impl.TextGenSupport#appendNode(SNode);;;;;;jetbrains.mps.text.impl.TextGenSupport#doAppendNode(SNode);;;;;;MethodDeclaration;EXTRACT;797fb7fc1415ac0ebe9a8262677dfa4462ed6cb4;797fb7fc1;;;;;;;;;1121377;Extract Method private doAppendNode(node SNode) : void extracted from public appendNode(node SNode) : void in class jetbrains.mps.text.impl.TextGenSupport
jetbrains.mps.lang.editor.cellProviders.SingleRoleCellProvider#createManyCells();;;;;;jetbrains.mps.lang.editor.cellProviders.SingleRoleCellProvider#createCell();;;;;;MethodDeclaration;INLINE;fe6653db5fb9f1a25d5ee30e4d5d54ccdaba65fa;fe6653db5;;;;;;;;;1132279;Inline Method private createManyCells() : EditorCell_Collection inlined to public createCell() : EditorCell in class jetbrains.mps.lang.editor.cellProviders.SingleRoleCellProvider
jetbrains.mps.ide.ui.tree.MPSTree#stringToPath(String);;;;;;jetbrains.mps.ide.ui.tree.MPSTree#getTreePath(List<String>,boolean);;;;;;MethodDeclaration;EXTRACT;7b5622d41537315710b6fd57b2739a3a64698375;7b5622d41;;;;;;;;;1136831;Extract Method private getTreePath(components List<String>, escapePathSep boolean) : TreePath extracted from private stringToPath(pathString String) : TreePath in class jetbrains.mps.ide.ui.tree.MPSTree
jetbrains.mps.project.AbstractModule#rename(String);;;;;;jetbrains.mps.project.AbstractModule#renameModels(String,String);;;;;;MethodDeclaration;EXTRACT;ce4b0e22659c16ae83d421f9621fd3e922750764;ce4b0e226;;;;;;;;;1153761;Extract Method protected renameModels(oldName String, newName String) : void extracted from public rename(newName String) : void in class jetbrains.mps.project.AbstractModule
jetbrains.mps.nodeEditor.cellProviders.AbstractCellListHandler#insertNewChild(EditorContext,EditorCell,boolean);;;;;;jetbrains.mps.nodeEditor.cellProviders.AbstractCellListHandler#startInsertMode(EditorContext,EditorCell,boolean);;;;;;MethodDeclaration;EXTRACT;61b5decd4a4e5e6bbdea99eb76f136ca10915b73;61b5decd4;;;;;;;;;1159637;Extract Method public startInsertMode(editorContext EditorContext, anchorCell EditorCell, insertBefore boolean) : void extracted from public insertNewChild(editorContext EditorContext, anchorCell EditorCell, insertBefore boolean) : void in class jetbrains.mps.nodeEditor.cellProviders.AbstractCellListHandler
