id;entityBeforeFullName;entityBeforeSimpleName;entityBeforeLocation;entityBeforeParameters;entityBeforeLine;entityBeforeParents;entityAfterFullName;entityAfterSimpleName;entityAfterLocation;entityAfterParameters;entityAfterLine;entityAfterParents;refactoringLevel;refactoringType;commitHash;abbreviatedCommitHash;authorName;authorEmail;authorDate;authorDateUnixTimestamp;committerName;committerEmail;committerDate;committerDateUnixTimestamp;idOracle;descriptionOracle
0;org.rstudio.core.client.widget.ScrollableToolbarPopupMenu#wrapMenuBar(ToolbarMenuBar);;;;;;org.rstudio.core.client.widget.ScrollableToolbarPopupMenu#setMaxHeight(int);;;;;;MethodDeclaration;EXTRACT;cb49e436b9d7ee55f2531ebc2ef1863f5c9ba9fe;cb49e436b;;;;;;;;;1100663;Extract Method protected setMaxHeight(maxHeight int) : void extracted from protected wrapMenuBar(menuBar ToolbarMenuBar) : Widget in class org.rstudio.core.client.widget.ScrollableToolbarPopupMenu
1;org.rstudio.studio.client.workbench.views.source.editors.text.ChunkOptionsPopupPanel#init(AceEditorWidget,Position);;;;;;org.rstudio.studio.client.workbench.views.source.editors.text.ChunkOptionsPopupPanel#getBoolean(String);;;;;;MethodDeclaration;EXTRACT;9a581e07cb6381d70f3fd9bb2055e810e2a682a9;9a581e07c;;;;;;;;;1118145;Extract Method private getBoolean(key String) : boolean extracted from public init(widget AceEditorWidget, position Position) : void in class org.rstudio.studio.client.workbench.views.source.editors.text.ChunkOptionsPopupPanel
2;org.rstudio.studio.client.workbench.views.source.editors.text.ChunkOptionsPopupPanel#init(AceEditorWidget,Position);;;;;;org.rstudio.studio.client.workbench.views.source.editors.text.ChunkOptionsPopupPanel#has(String);;;;;;MethodDeclaration;EXTRACT;9a581e07cb6381d70f3fd9bb2055e810e2a682a9;9a581e07c;;;;;;;;;1118145;Extract Method private has(key String) : boolean extracted from public init(widget AceEditorWidget, position Position) : void in class org.rstudio.studio.client.workbench.views.source.editors.text.ChunkOptionsPopupPanel
3;org.rstudio.studio.client.workbench.views.source.editors.text.ChunkOptionsPopupPanel#init(AceEditorWidget,Position);;;;;;org.rstudio.studio.client.workbench.views.source.editors.text.ChunkOptionsPopupPanel#get(String);;;;;;MethodDeclaration;EXTRACT;9a581e07cb6381d70f3fd9bb2055e810e2a682a9;9a581e07c;;;;;;;;;1118145;Extract Method public get(key String) : String extracted from public init(widget AceEditorWidget, position Position) : void in class org.rstudio.studio.client.workbench.views.source.editors.text.ChunkOptionsPopupPanel
4;org.rstudio.core.client.widget.ThemedCheckBox#setValue(boolean);;;;;;org.rstudio.core.client.widget.ThemedCheckBox#setValue(boolean,boolean);;;;;;MethodDeclaration;EXTRACT;4983f83d1bedb7b737fc56d409c1c06b04e34e4e;4983f83d1;;;;;;;;;1120314;Extract Method private setValue(value boolean, force boolean) : void extracted from public setValue(value boolean) : void in class org.rstudio.core.client.widget.ThemedCheckBox
5;org.rstudio.studio.client.workbench.views.source.editors.text.ChunkOptionsPopupPanel#ChunkOptionsPopupPanel();;;;;;org.rstudio.studio.client.workbench.views.source.editors.text.ChunkOptionsPopupPanel#verticalSpacer(int);;;;;;MethodDeclaration;EXTRACT;4983f83d1bedb7b737fc56d409c1c06b04e34e4e;4983f83d1;;;;;;;;;1120314;Extract Method private verticalSpacer(sizeInPixels int) : FlowPanel extracted from public ChunkOptionsPopupPanel() in class org.rstudio.studio.client.workbench.views.source.editors.text.ChunkOptionsPopupPanel
6;org.rstudio.studio.client.rsconnect.ui.RSConnectDeploy#getResult();;;;;;org.rstudio.studio.client.rsconnect.ui.RSConnectDeploy#isUpdate();;;;;;MethodDeclaration;EXTRACT;229d1b60c03a3f8375451c68a6911660a3993777;229d1b60c;;;;;;;;;1127493;Extract Method private isUpdate() : boolean extracted from public getResult() : RSConnectPublishResult in class org.rstudio.studio.client.rsconnect.ui.RSConnectDeploy
7;org.rstudio.core.client.widget.Wizard#validate(T);;;;;;org.rstudio.core.client.widget.WizardPage#validateAsync(T,OperationWithInput<Boolean>);;;;;;MethodDeclaration;EXTRACT_MOVE;229d1b60c03a3f8375451c68a6911660a3993777;229d1b60c;;;;;;;;;1127493;Extract And Move Method protected validateAsync(input T, onValidated OperationWithInput<Boolean>) : void extracted from protected validate(input T) : boolean in class org.rstudio.core.client.widget.Wizard & moved to class org.rstudio.core.client.widget.WizardPage
8;org.rstudio.core.client.widget.ModalDialog#validateAndGo(T,Command);;;;;;org.rstudio.core.client.widget.ModalDialog#validateAsync(T,OperationWithInput<Boolean>);;;;;;MethodDeclaration;EXTRACT;229d1b60c03a3f8375451c68a6911660a3993777;229d1b60c;;;;;;;;;1127493;Extract Method protected validateAsync(input T, onValidated OperationWithInput<Boolean>) : void extracted from protected validateAndGo(input T, executeOnSuccess Command) : void in class org.rstudio.core.client.widget.ModalDialog
