entityBeforeFullName;entityBeforeSimpleName;entityBeforeLocation;entityBeforeParameters;entityBeforeLine;entityBeforeParents;entityAfterFullName;entityAfterSimpleName;entityAfterLocation;entityAfterParameters;entityAfterLine;entityAfterParents;refactoringLevel;refactoringType;commitHash;abbreviatedCommitHash;authorName;authorEmail;authorDate;authorDateUnixTimestamp;committerName;committerEmail;committerDate;committerDateUnixTimestamp;idOracle;descriptionOracle
com.google.gwt.dev.jjs.impl.ControlFlowAnalyzer.RescueVisitor#visit(JInterfaceType,Context);;;;;;com.google.gwt.dev.jjs.impl.ControlFlowAnalyzer.RescueVisitor#rescueMembersAndInstantiateSuperInterfaces(JDeclaredType);;;;;;MethodDeclaration;EXTRACT;22fb2c9c6974bd1fe0f6ff684f52e6cfbed1a387;22fb2c9c6;;;;;;;;;1124507;Extract Method private rescueMembersAndInstantiateSuperInterfaces(type JDeclaredType) : void extracted from public visit(type JInterfaceType, ctx Context) : boolean in class com.google.gwt.dev.jjs.impl.ControlFlowAnalyzer.RescueVisitor
com.google.gwt.dev.jjs.impl.ControlFlowAnalyzer.RescueVisitor#visit(JClassType,Context);;;;;;com.google.gwt.dev.jjs.impl.ControlFlowAnalyzer.RescueVisitor#rescueMembersAndInstantiateSuperInterfaces(JDeclaredType);;;;;;MethodDeclaration;EXTRACT;22fb2c9c6974bd1fe0f6ff684f52e6cfbed1a387;22fb2c9c6;;;;;;;;;1124507;Extract Method private rescueMembersAndInstantiateSuperInterfaces(type JDeclaredType) : void extracted from public visit(type JClassType, ctx Context) : boolean in class com.google.gwt.dev.jjs.impl.ControlFlowAnalyzer.RescueVisitor
com.google.gwt.dev.jjs.impl.ControlFlowAnalyzer.RescueVisitor#rescueAndInstantiate(JClassType);;;;;;com.google.gwt.dev.jjs.impl.ControlFlowAnalyzer.RescueVisitor#visit(JNewInstance,Context);;;;;;MethodDeclaration;INLINE;22fb2c9c6974bd1fe0f6ff684f52e6cfbed1a387;22fb2c9c6;;;;;;;;;1124507;Inline Method private rescueAndInstantiate(type JClassType) : void inlined to public visit(x JNewInstance, ctx Context) : boolean in class com.google.gwt.dev.jjs.impl.ControlFlowAnalyzer.RescueVisitor
com.google.gwt.dev.jjs.impl.ControlFlowAnalyzer.RescueVisitor#rescueAndInstantiate(JClassType);;;;;;com.google.gwt.dev.jjs.impl.ControlFlowAnalyzer.RescueVisitor#visit(JsniMethodRef,Context);;;;;;MethodDeclaration;INLINE;22fb2c9c6974bd1fe0f6ff684f52e6cfbed1a387;22fb2c9c6;;;;;;;;;1124507;Inline Method private rescueAndInstantiate(type JClassType) : void inlined to public visit(x JsniMethodRef, ctx Context) : boolean in class com.google.gwt.dev.jjs.impl.ControlFlowAnalyzer.RescueVisitor
com.google.gwt.dev.jjs.ast.JTypeOracle#canBeInstantiatedInJavascript(JType);;;;;;com.google.gwt.dev.jjs.impl.ControlFlowAnalyzer.RescueVisitor#canBeInstantiatedInJavaScript(JType);;;;;;MethodDeclaration;INLINE;22fb2c9c6974bd1fe0f6ff684f52e6cfbed1a387;22fb2c9c6;;;;;;;;;1124507;Move And Inline Method public canBeInstantiatedInJavascript(type JType) : boolean moved from class com.google.gwt.dev.jjs.ast.JTypeOracle to class com.google.gwt.dev.jjs.impl.ControlFlowAnalyzer.RescueVisitor & inlined to private canBeInstantiatedInJavaScript(type JType) : boolean
com.google.gwt.user.cellview.client.AbstractCellTableBuilder#startRow();;;;;;com.google.gwt.user.cellview.client.AbstractCellTableBuilder#startRow(T);;;;;;MethodDeclaration;EXTRACT;892d1760c8e4c76c369cd5ec1eaed215d3a22c8a;892d1760c;;;;;;;;;1155773;Extract Method public startRow(rowValue T) : TableRowBuilder extracted from public startRow() : TableRowBuilder in class com.google.gwt.user.cellview.client.AbstractCellTableBuilder
